{
  "$schema": "./spec/conformance.schema.json",
  "version": "2.2.0",
  "timezone": "UTC",
  "note": "Generated from the built library by scripts/extract-conformance.ts. See SPEC.md for the normative rules these vectors encode, including the runtime invariants that no vector can express.",
  "levels": [
    {
      "value": 100,
      "key": "peak",
      "label": "Peak",
      "description": "High capacity. Planning, complex decisions, creative work.",
      "cognitiveProfile": {
        "decisionCapacity": "high",
        "focusDuration": "extended",
        "taskComplexity": "complex",
        "interruptionTolerance": "high"
      }
    },
    {
      "value": 75,
      "key": "active",
      "label": "Active",
      "description": "Good capacity. Focused execution, problem-solving.",
      "cognitiveProfile": {
        "decisionCapacity": "moderate",
        "focusDuration": "moderate",
        "taskComplexity": "moderate",
        "interruptionTolerance": "moderate"
      }
    },
    {
      "value": 50,
      "key": "steady",
      "label": "Steady",
      "description": "Moderate capacity. Routine tasks, familiar work.",
      "cognitiveProfile": {
        "decisionCapacity": "low",
        "focusDuration": "short",
        "taskComplexity": "routine",
        "interruptionTolerance": "low"
      }
    },
    {
      "value": 25,
      "key": "low",
      "label": "Low",
      "description": "Limited capacity. Simple tasks, review, light work.",
      "cognitiveProfile": {
        "decisionCapacity": "minimal",
        "focusDuration": "minimal",
        "taskComplexity": "simple",
        "interruptionTolerance": "minimal"
      }
    },
    {
      "value": 0,
      "key": "rest",
      "label": "Rest",
      "description": "Recovery. Consumption only — reading, reflecting.",
      "cognitiveProfile": {
        "decisionCapacity": "none",
        "focusDuration": "none",
        "taskComplexity": "consumption",
        "interruptionTolerance": "none"
      }
    }
  ],
  "cycle": [
    {
      "from": 100,
      "to": 75
    },
    {
      "from": 75,
      "to": 50
    },
    {
      "from": 50,
      "to": 25
    },
    {
      "from": 25,
      "to": 0
    },
    {
      "from": 0,
      "to": 100
    }
  ],
  "strategies": {
    "ui-visibility": {
      "0": {
        "sidebar": false,
        "tabBar": false,
        "statusBar": false,
        "toolbar": false,
        "chromeOpacity": 0.05,
        "chromeOpacityHover": 0.8,
        "contentMaxWidth": "75ch",
        "contentFontScale": 1.1,
        "readOnlyCursor": true
      },
      "25": {
        "sidebar": false,
        "tabBar": false,
        "statusBar": false,
        "toolbar": true,
        "chromeOpacity": 0.1,
        "chromeOpacityHover": 1,
        "contentMaxWidth": "80ch",
        "contentFontScale": 1.05,
        "readOnlyCursor": false
      },
      "50": {
        "sidebar": true,
        "tabBar": true,
        "statusBar": true,
        "toolbar": true,
        "chromeOpacity": 0.4,
        "chromeOpacityHover": 1,
        "contentMaxWidth": "90ch",
        "contentFontScale": 1,
        "readOnlyCursor": false
      },
      "75": {
        "sidebar": true,
        "tabBar": true,
        "statusBar": true,
        "toolbar": true,
        "chromeOpacity": 0.7,
        "chromeOpacityHover": 1,
        "contentMaxWidth": "none",
        "contentFontScale": 1,
        "readOnlyCursor": false
      },
      "100": {
        "sidebar": true,
        "tabBar": true,
        "statusBar": true,
        "toolbar": true,
        "chromeOpacity": 1,
        "chromeOpacityHover": 1,
        "contentMaxWidth": "none",
        "contentFontScale": 1,
        "readOnlyCursor": false
      }
    },
    "notifications": {
      "0": {
        "allowVisual": false,
        "allowSound": false,
        "allowVibration": false,
        "batchInterval": 0,
        "priorityThreshold": "none"
      },
      "25": {
        "allowVisual": true,
        "allowSound": false,
        "allowVibration": false,
        "batchInterval": 900000,
        "priorityThreshold": "critical"
      },
      "50": {
        "allowVisual": true,
        "allowSound": false,
        "allowVibration": false,
        "batchInterval": 300000,
        "priorityThreshold": "high"
      },
      "75": {
        "allowVisual": true,
        "allowSound": true,
        "allowVibration": false,
        "batchInterval": 0,
        "priorityThreshold": "all"
      },
      "100": {
        "allowVisual": true,
        "allowSound": true,
        "allowVibration": true,
        "batchInterval": 0,
        "priorityThreshold": "all"
      }
    },
    "task-complexity": {
      "0": {
        "maxComplexity": "consumption",
        "suggestBreaks": false,
        "breakIntervalMinutes": 0
      },
      "25": {
        "maxComplexity": "simple",
        "suggestBreaks": true,
        "breakIntervalMinutes": 25
      },
      "50": {
        "maxComplexity": "routine",
        "suggestBreaks": true,
        "breakIntervalMinutes": 45
      },
      "75": {
        "maxComplexity": "moderate",
        "suggestBreaks": false,
        "breakIntervalMinutes": 0
      },
      "100": {
        "maxComplexity": "complex",
        "suggestBreaks": false,
        "breakIntervalMinutes": 0
      }
    },
    "interaction-forgiveness": {
      "0": {
        "undoWindowMs": 20000,
        "confirmDestructive": true,
        "autosaveIntervalMs": 15000
      },
      "25": {
        "undoWindowMs": 15000,
        "confirmDestructive": true,
        "autosaveIntervalMs": 20000
      },
      "50": {
        "undoWindowMs": 10000,
        "confirmDestructive": true,
        "autosaveIntervalMs": 30000
      },
      "75": {
        "undoWindowMs": 8000,
        "confirmDestructive": false,
        "autosaveIntervalMs": 45000
      },
      "100": {
        "undoWindowMs": 5000,
        "confirmDestructive": false,
        "autosaveIntervalMs": 60000
      }
    },
    "deferral": {
      "0": {
        "orderedPresetIds": [
          "tomorrow-morning",
          "next-monday",
          "next-workday",
          "this-evening",
          "in-1-hour"
        ],
        "defaultPresetId": "tomorrow-morning"
      },
      "25": {
        "orderedPresetIds": [
          "tomorrow-morning",
          "next-workday",
          "this-evening",
          "next-monday",
          "in-1-hour"
        ],
        "defaultPresetId": "tomorrow-morning"
      },
      "50": {
        "orderedPresetIds": [
          "this-evening",
          "tomorrow-morning",
          "in-1-hour",
          "next-workday",
          "next-monday"
        ],
        "defaultPresetId": "this-evening"
      },
      "75": {
        "orderedPresetIds": [
          "in-1-hour",
          "this-evening",
          "tomorrow-morning",
          "next-workday",
          "next-monday"
        ],
        "defaultPresetId": "in-1-hour"
      },
      "100": {
        "orderedPresetIds": [
          "in-1-hour",
          "this-evening",
          "tomorrow-morning",
          "next-workday",
          "next-monday"
        ],
        "defaultPresetId": "in-1-hour"
      }
    },
    "autonomy": {
      "0": {
        "confidenceThreshold": 1,
        "allowGeneratedContent": false,
        "maxUnattendedSteps": 1
      },
      "25": {
        "confidenceThreshold": 0.9,
        "allowGeneratedContent": false,
        "maxUnattendedSteps": 1
      },
      "50": {
        "confidenceThreshold": 0.8,
        "allowGeneratedContent": true,
        "maxUnattendedSteps": 3
      },
      "75": {
        "confidenceThreshold": 0.7,
        "allowGeneratedContent": true,
        "maxUnattendedSteps": 5
      },
      "100": {
        "confidenceThreshold": 0.6,
        "allowGeneratedContent": true,
        "maxUnattendedSteps": 8
      }
    },
    "demand-admission": {
      "0": {
        "originatorThreshold": "exempt",
        "acknowledge": true,
        "acknowledgmentDetail": "minimal"
      },
      "25": {
        "originatorThreshold": "exempt",
        "acknowledge": true,
        "acknowledgmentDetail": "brief"
      },
      "50": {
        "originatorThreshold": "exempt",
        "acknowledge": true,
        "acknowledgmentDetail": "full"
      },
      "75": {
        "originatorThreshold": "known",
        "acknowledge": true,
        "acknowledgmentDetail": "full"
      },
      "100": {
        "originatorThreshold": "all",
        "acknowledge": false,
        "acknowledgmentDetail": "full"
      }
    }
  },
  "presence": {
    "atOrAbove": {
      "0": {
        "0": "visible",
        "25": "visible",
        "50": "visible",
        "75": "visible",
        "100": "visible"
      },
      "25": {
        "0": "hidden",
        "25": "visible",
        "50": "visible",
        "75": "visible",
        "100": "visible"
      },
      "50": {
        "0": "hidden",
        "25": "hidden",
        "50": "visible",
        "75": "visible",
        "100": "visible"
      },
      "75": {
        "0": "hidden",
        "25": "hidden",
        "50": "hidden",
        "75": "visible",
        "100": "visible"
      },
      "100": {
        "0": "hidden",
        "25": "hidden",
        "50": "hidden",
        "75": "hidden",
        "100": "visible"
      }
    },
    "atOrAboveMuted": {
      "0": {
        "0": "visible",
        "25": "visible",
        "50": "visible",
        "75": "visible",
        "100": "visible"
      },
      "25": {
        "0": "muted",
        "25": "visible",
        "50": "visible",
        "75": "visible",
        "100": "visible"
      },
      "50": {
        "0": "muted",
        "25": "muted",
        "50": "visible",
        "75": "visible",
        "100": "visible"
      },
      "75": {
        "0": "muted",
        "25": "muted",
        "50": "muted",
        "75": "visible",
        "100": "visible"
      },
      "100": {
        "0": "muted",